<?xml version="1.0" encoding="UTF-8"?>
<!DOCTYPE accident-report [
<!ELEMENT accident-report (accident-unit)>
<!ELEMENT accident-unit (person-involved, accident-info, abstract)>

<!ELEMENT person-involved (family-name, first-name, age, gender, position)>
<!ELEMENT family-name (#PCDATA)>
<!ELEMENT first-name (#PCDATA)>
<!ELEMENT age (#PCDATA)>
<!ELEMENT gender (#PCDATA)>
<!ELEMENT position (#PCDATA)>

<!ELEMENT accident-info (occuring-date, situation, type)>

<!ELEMENT occuring-date (year, month, date, time)>
<!ELEMENT year (#PCDATA)>
<!ELEMENT month (#PCDATA)>
<!ELEMENT date (#PCDATA)>
<!ELEMENT time (#PCDATA)>

<!ELEMENT situation (#PCDATA)>
<!ELEMENT type (#PCDATA)>

<!ELEMENT abstract (#PCDATA)>
]>
<accident-report>
	<accident-unit>
		<person-involved>
			<family-name>山田</family-name>
			<first-name>花子</first-name>
			<age>22</age>
			<gender>2</gender>
			<position>1</position>
		</person-involved>
		
		<accident-info>
			<occuring-date>
				<year>2021</year>
				<month>3</month>
				<date>29</date>
				<time>18</time>
			</occuring-date>
			<situation>2</situation>
			<type>3</type>
		</accident-info>
		
		<abstract>
			滑って転んだ。
		</abstract>
	</accident-unit>
</accident-report>
